{
  "schema_version": "1.0",
  "mode": "plan",
  "disclosure": "internal",
  "title": "Infrastructure plan review",
  "generated_at": "2026-10-03T09:00:00Z",
  "tool": {
    "name": "tfviz",
    "version": "test"
  },
  "producer": {
    "name": "terraform",
    "version": "1.16.4",
    "format_version": "1.2"
  },
  "source": {
    "kind": "stdin",
    "timestamp_status": "known",
    "timestamp": "2026-10-03T02:55:36Z"
  },
  "completeness": {
    "status": "complete"
  },
  "summary": {
    "create": 3,
    "update": 6,
    "delete": 1,
    "replace": 2,
    "read": 1,
    "forget": 0,
    "no_op": 26,
    "unsupported": 0
  },
  "coverage": {
    "resources_total": 39,
    "resources_supported": 38,
    "resources_generic": 1
  },
  "resources": [
    {
      "id": "r1",
      "address": "aws_db_instance.orders",
      "label": "review-orders",
      "type": "aws_db_instance",
      "family": "database",
      "role": "entity",
      "mode": "managed",
      "module": "",
      "provider": "hashicorp/aws",
      "support": "supported",
      "change": {
        "action": "update",
        "producer_actions": [
          "update"
        ]
      },
      "groups": {
        "architecture": "g3",
        "modules": "m12"
      },
      "metadata": [
        {
          "key": "identifier",
          "label": "Identifier",
          "after": {
            "status": "known",
            "value": "review-orders"
          },
          "change_status": "unchanged"
        },
        {
          "key": "engine",
          "label": "Engine",
          "after": {
            "status": "known",
            "value": "postgres"
          },
          "change_status": "unchanged"
        },
        {
          "key": "engine_version",
          "label": "Engine version",
          "after": {
            "status": "known",
            "value": "17.4"
          },
          "change_status": "unchanged"
        },
        {
          "key": "instance_class",
          "label": "Instance class",
          "before": {
            "status": "known",
            "value": "db.t4g.medium"
          },
          "after": {
            "status": "known",
            "value": "db.r7g.large"
          },
          "change_status": "changed"
        },
        {
          "key": "allocated_storage",
          "label": "Storage (GiB)",
          "after": {
            "status": "known",
            "value": 50
          },
          "change_status": "unchanged"
        },
        {
          "key": "storage_encrypted",
          "label": "Storage encrypted",
          "after": {
            "status": "known",
            "value": true
          },
          "change_status": "unchanged"
        },
        {
          "key": "multi_az",
          "label": "Multi-AZ",
          "after": {
            "status": "known",
            "value": false
          },
          "change_status": "unchanged"
        },
        {
          "key": "publicly_accessible",
          "label": "Publicly accessible",
          "after": {
            "status": "known",
            "value": false
          },
          "change_status": "unchanged"
        },
        {
          "key": "username",
          "label": "Master username",
          "after": {
            "status": "omitted"
          },
          "change_status": "unchanged"
        },
        {
          "key": "password",
          "label": "Master password",
          "before": {
            "status": "sensitive"
          },
          "after": {
            "status": "sensitive"
          },
          "change_status": "changed"
        },
        {
          "key": "endpoint",
          "label": "Endpoint",
          "after": {
            "status": "known",
            "value": "5c5fe5f0.fixture.invalid"
          },
          "change_status": "unchanged"
        },
        {
          "key": "tags",
          "label": "Tags",
          "after": {
            "status": "omitted"
          },
          "change_status": "unchanged"
        }
      ]
    },
    {
      "id": "r2",
      "address": "aws_db_subnet_group.main",
      "label": "review-db",
      "type": "aws_db_subnet_group",
      "family": "database",
      "role": "association",
      "mode": "managed",
      "module": "",
      "provider": "hashicorp/aws",
      "support": "supported",
      "change": {
        "action": "no_op",
        "producer_actions": [
          "no-op"
        ]
      },
      "groups": {
        "architecture": "g3",
        "modules": "m12"
      },
      "metadata": [
        {
          "key": "name",
          "label": "Name",
          "after": {
            "status": "known",
            "value": "review-db"
          },
          "change_status": "unchanged"
        },
        {
          "key": "description",
          "label": "Description",
          "after": {
            "status": "omitted"
          },
          "change_status": "unchanged"
        }
      ]
    },
    {
      "id": "r3",
      "address": "aws_eip.nat",
      "label": "Elastic IP nat",
      "type": "aws_eip",
      "family": "network",
      "role": "entity",
      "mode": "managed",
      "module": "",
      "provider": "hashicorp/aws",
      "support": "supported",
      "change": {
        "action": "no_op",
        "producer_actions": [
          "no-op"
        ]
      },
      "groups": {
        "architecture": "g10",
        "modules": "m12"
      },
      "metadata": [
        {
          "key": "public_ip",
          "label": "Public IP",
          "after": {
            "status": "known",
            "value": "203.0.113.100"
          },
          "change_status": "unchanged"
        },
        {
          "key": "domain",
          "label": "Domain",
          "after": {
            "status": "known",
            "value": "vpc"
          },
          "change_status": "unchanged"
        },
        {
          "key": "tags",
          "label": "Tags",
          "after": {
            "status": "omitted"
          },
          "change_status": "unchanged"
        }
      ]
    },
    {
      "id": "r4",
      "address": "aws_instance.bastion",
      "label": "aws_instance.bastion",
      "type": "aws_instance",
      "family": "other",
      "role": "entity",
      "mode": "managed",
      "module": "",
      "provider": "hashicorp/aws",
      "support": "generic",
      "change": {
        "action": "update",
        "producer_actions": [
          "update"
        ]
      },
      "groups": {
        "architecture": "g11",
        "modules": "m12"
      },
      "metadata": []
    },
    {
      "id": "r5",
      "address": "aws_internet_gateway.main",
      "label": "Internet gateway main",
      "type": "aws_internet_gateway",
      "family": "network",
      "role": "entity",
      "mode": "managed",
      "module": "",
      "provider": "hashicorp/aws",
      "support": "supported",
      "change": {
        "action": "no_op",
        "producer_actions": [
          "no-op"
        ]
      },
      "groups": {
        "architecture": "g3",
        "modules": "m12"
      },
      "metadata": [
        {
          "key": "id",
          "label": "Gateway ID",
          "after": {
            "status": "known",
            "value": "igw-06498496a56dea3fa"
          },
          "change_status": "unchanged"
        },
        {
          "key": "tags",
          "label": "Tags",
          "after": {
            "status": "omitted"
          },
          "change_status": "unchanged"
        }
      ]
    },
    {
      "id": "r6",
      "address": "aws_lb.public",
      "label": "review-public",
      "type": "aws_lb",
      "family": "load_balancing",
      "role": "entity",
      "mode": "managed",
      "module": "",
      "provider": "hashicorp/aws",
      "support": "supported",
      "change": {
        "action": "no_op",
        "producer_actions": [
          "no-op"
        ]
      },
      "groups": {
        "architecture": "g3",
        "modules": "m12"
      },
      "metadata": [
        {
          "key": "name",
          "label": "Name",
          "after": {
            "status": "known",
            "value": "review-public"
          },
          "change_status": "unchanged"
        },
        {
          "key": "load_balancer_type",
          "label": "Type",
          "after": {
            "status": "known",
            "value": "application"
          },
          "change_status": "unchanged"
        },
        {
          "key": "internal",
          "label": "Internal",
          "after": {
            "status": "known",
            "value": false
          },
          "change_status": "unchanged"
        },
        {
          "key": "dns_name",
          "label": "DNS name",
          "after": {
            "status": "known",
            "value": "0035790b.fixture.invalid"
          },
          "change_status": "unchanged"
        },
        {
          "key": "arn",
          "label": "ARN",
          "after": {
            "status": "known",
            "value": "arn:aws:elasticloadbalancing:eu-west-1:111122223333:loadbalancer/app/review-public/28e23727f67e69d5"
          },
          "change_status": "unchanged"
        },
        {
          "key": "tags",
          "label": "Tags",
          "after": {
            "status": "omitted"
          },
          "change_status": "unchanged"
        }
      ]
    },
    {
      "id": "r7",
      "address": "aws_lb_listener.https",
      "label": "Listener https",
      "type": "aws_lb_listener",
      "family": "load_balancing",
      "role": "entity",
      "mode": "managed",
      "module": "",
      "provider": "hashicorp/aws",
      "support": "supported",
      "change": {
        "action": "no_op",
        "producer_actions": [
          "no-op"
        ]
      },
      "groups": {
        "architecture": "g3",
        "modules": "m12"
      },
      "metadata": [
        {
          "key": "port",
          "label": "Port",